id,Citation,Year,Type,doi,Title,Team
ref0135,Eger et al. 1997,1997,Journal Article,NA,Minimum Alveolar Anesthetic Concentration Values for the Enantiomers of Isoflurane Differ Minimally,Eger
ref0136,Best et al. 1997,1997,Journal Article,10.1021/jp971264j,GB/SA-Based Continuum Solvation Model for Octanol,Best
ref0137,Eger et al. 1999,1999,Journal Article,10.1213/00000539-199904000-00035,Minimum Alveolar Anesthetic Concentration of Fluorinated Alkanols in Rats: Relevance to Theories of Narcosis,Eger
ref0138,Cousins and Mackay 2000,2000,Journal Article,10.1016/S0045-6535(00)00005-9,Correlating the physical–chemical properties of phthalate esters using the `three solubility' approach,Mackay
ref0139,Eger et al. 2001,2001,Journal Article,10.1097/00000539-200110000-00025,"The Convulsant and Anesthetic Properties of Cis-Trans Isomers of 1,2-Dichlorohexafluorocyclobutane and 1,2-Dichloroethylene",Eger
ref0140,Oliferenko et al. 2004,2004,Journal Article,10.1021/ci0342932,Theoretical Scales of Hydrogen Bond Acidity and Basicity for Application in QSAR/QSPR Studies and Drug Design. Partitioning of Aliphatic Compounds,Oliferenko
ref0141,Abraham et al. 2005,2005,Journal Article,10.1039/b418293f,The estimation of physicochemical properties of methyl and other alkyl naphthalenes,Abraham
ref0142,Yao et al. 2007,2007,Journal Article,10.1021/es061725r,Sources and Occurrence of Dacthal in the Canadian Atmosphere,Harner
ref0143,Nabi et al. 2014,2014,Journal Article,10.1021/es501674p,Mapping Environmental Partitioning Properties of Nonpolar Complex Mixtures by Use of GC × GC,Nabi
ref0144,Leng et al. 2015,2015,Journal Article,10.1002/2015GL063840,"Effects of temperature, pH, and ionic strength on the Henry's law constant of triethylamine",Leng
ref0145,Vikas and Chayawan 2015,2015,Journal Article,10.1016/j.chemosphere.2014.08.072,Single-descriptor based quantum-chemical QSPRs for physico-chemical properties of polychlorinated-dibenzo-p-dioxins and -dibenzo-furans (PCDD/Fs): Exploring the role of electron-correlation,Vikas
ref0146,Kim et al. 2016,2016,Journal Article,10.1016/j.envpol.2016.02.007,Predictability of physicochemical properties of polychlorinated dibenzo-p-dioxins (PCDDs) based on single-molecular descriptor models,Kim
ref0147,Yaman et al. 2020,2020,Journal Article,10.1021/acs.est.0c02823,Measurement and Modeling the Phase Partitioning of Organophosphate Esters Using Their Temperature-Dependent Octanol–Air Partition Coefficients and Vapor Pressures,Odabasi
ref0148,Giesen et al. 1997,1997,Journal Article,10.1007/s002140050283,A universal model for the quantum mechanical calculation of free energies of solvation in non-aqueous solvents,Truhlar
ref0149,Zhu et al. 1998,1998,Journal Article,10.1063/1.476521,Density functional solvation model based on CM2 atomic charges,Truhlar
ref0150,Li et al. 1999,1999,Journal Article,10.1007/s002149900004,Extension of the platform of applicability of the SM5.42R universal solvation model,Truhlar
ref0151,Duffy and Jorgensen 2000,2000,Journal Article,10.1021/ja993663t,"Prediction of Properties from Simulations:? Free Energies of Solvation in Hexadecane, Octanol, and Water",Duffy
ref0152,Roberts 2005,2005,Journal Article,10.1029/2004GL022327,Measurement of the Henry's law coefficient and first order loss rate of PAN in n?octanol,Roberts
ref0153,Zhang et al. 2016,2016,Journal Article,10.1016/j.chemosphere.2015.11.017,Novel flame retardants: Estimating the physical–chemical properties and environmental fate of 94 halogenated and organophosphate PBDE replacements,Diamond
ref0154,Mathieu 2020,2020,Journal Article,10.1016/j.chemosphere.2019.125584,QSPR versus fragment-based methods to predict octanol-air partition coefficients: Revisiting a recent comparison of both approaches,Mathieu
ref0155,Li et al. 2020,2020,Journal Article,10.1016/j.chemosphere.2019.125246,Prediction of octanol-air partition coefficients for PCBs at different ambient temperatures based on the solvation free energy and the dimer ratio,Peijnenburg
